Date,Title,Link
4 February 2021,Bacteria Make Antivirals,https://www.virology.ws/2021/02/04/bacteria-make-antivirals/
3 February 2021,Trial By Error: An Excerpt from Jamison Hill’s Memoir,https://www.virology.ws/2021/02/03/trial-by-error-an-excerpt-from-jamison-hills-memoir/
28 January 2021,SARS-CoV-2 variants of concern,https://www.virology.ws/2021/01/28/sars-cov-2-variants-of-concern/
28 January 2021,Trial By Error: Professor Paul Garner’s BMJ Blog Post on His Powerful Cognitions,https://www.virology.ws/2021/01/28/trial-by-error-professor-paul-garners-bmj-blog-post-on-his-powerful-cognitions/
27 January 2021,Trial By Error: Professor Lubet’s Inquiry to Medical Center Holding ME/CFS Patient,https://www.virology.ws/2021/01/27/trial-by-error-professor-lubets-inquiry-to-medical-center-holding-me-cfs-patient/
26 January 2021,Trial By Error: My Exchange with Minnesota Medical Center Holding ME/CFS Patient,https://www.virology.ws/2021/01/26/trial-by-error-my-exchange-with-minnesota-medical-center-holding-me-cfs-patient/
24 January 2021,Trial By Error: Game-Changing Articles in The Guardian and The New York Times,https://www.virology.ws/2021/01/24/trial-by-error-game-changing-articles-in-the-guardian-and-the-new-york-times/
21 January 2021,Biden’s pandemic plans,https://www.virology.ws/2021/01/21/bidens-pandemic-plans/
15 January 2021,Trial By Error: New Study Reports First-Hand Accounts of 1955 Hospital Outbreak,https://www.virology.ws/2021/01/15/trial-by-error-new-study-reports-first-hand-accounts-of-1955-hospital-outbreak/
14 January 2021,Camelids for COVID,https://www.virology.ws/2021/01/14/camelids-for-covid/
